,id,runtime,category,url,year,fellow_accuracy_rating,automl_confidence_avg,automl_confidence_min,automl_confidence_max,computer_transcript,human_transcript,sentiment,magnitude,human_sentiment,human_magnitude,war,bleu_score
19,tobacco_qdo23e00,4880.0,Advertising,https://archive.org/download/tobacco_qdo23e00/Bates_2058500031_chunk_1_512kb.mp4,1959.0,Fair,0.844844992,0.5593862,0.9128387,today cigarette cannot answer today smoking me only saratoga meets the new challenge the first totally new cigarette saratoga gives you the world's first humor flex packed moisture proof vacuumformed keep cigarettes twice is fresh and flavorful as any other package cam saratoga gives you a new team of filters backtoback one filter fortified with shark ron scrubs flavor to make it clean the other keeps it mild now you have the filter you hoped for the flavor you smoke for fresh tobacco flavor that just couldn't be brought to you without this humor flex pack new blend new new team of filters backtoback only saratoga meets the challenge of today smoking needs more than you it's timely to new truck run smooth saratoga cigarette smooth is taste tobacco ever had saratoga's ultramodern filters double screen the smoke one filter fortified with chart run smooth the smoke the second of pure white filter makes it mild together they double screen the smoke to give saratoga the smoothest taste tobacco ever had and saratoga keeps that rich tobacco flavor because the soft seamless pack keeps flavor in this empty pack test proves saratoga holds moisture and flavor as no conventional packed cat the fact that leaks water leaks flavored but saratoga's hummus like plastic pack seals in the fool freshly try new saratoga it's truck run smooth smooth is taste tobacco ever had saratoga it's new it's ultra it's ultra mild its new saratoga in the humor flex plastic pack first ultra mild cigarette saratoga double screams the flavor clean one filter fortified with char cron screens flavor to make it clean the other re screens it to make it mild together they double screen the flavor cling to make saratoga the first ultra mild cigarette and saratoga keeps its rich tobacco flavor because the new scene plastic pack keeps moisture in try this yourself empty out of conventional pack and 2pack of saratoga's or a little water into each see just as the water runs out moisture and fresh flavor escape from the regular pack but saratoga seamless plastic that keeps the fresh moist flavor in trying new saratoga it's oprah it's ultra mild it's the first ultra mild cigarette everything's new in saratoga this is totally new saratoga cigarette in the world's first human flex packed moistureproof vacuumformed to keep cigarettes twice as fresh and flavorful as any other package can saratoga gives you a new team of builders backtoback one filter fortified with shark ron scrubs flavor clean the other keeps it in mild get the filter you hoped for the flavor you smoke for in totally new saratoga more than you it's timely to mute rock run smooth saratoga cigarette saratoga's ultramodern filters double screen the smoke for the smoothest taste tobacco ever had and saratoga keeps that rich tobacco flavor because the handsome humor flex plastic pack keeps flavor in try new saratoga it stark run smooth smooth is taste tobacco ever had saratoga new blend new humor flex pack new team of filters backtoback everything's new in saratoga cigarettes everything's new in saratoga cigarettes new blend new yuma flex pack new team of filters back to back saratoga the cigarette that meets the challenge of today's smoking needs new blend new humor flex pack new team of filters backtoback saratoga new truck runs smooth saratoga double screams the smoke for the smoothest taste tobacco ever had saratoga this is mayfield fresh new way to smoke the only menthol cigarette with the recessed filter the most effective filtering method known to cigarette makers most filters are at the tip but mayfield filter is inside it's clean it can't touch your tongue it's recessed this is super filtration there's no better filter on any leading cigarette menthol or otherwise mayfield the truly effective filter you've been wanting just enough menthol and just enough menthol to smooth out the smoke not enough to blur the taste of the good tobacco's the filter can't touch your tongue because it's inside the mayfield filter is recessed fresh mayfield leaves your mouth feeling fresh moist clean enjoy this fresh new way to smoke may be healed this is mayfield the only menthol cigarette with a recessed filter mayfield filter is inside can't touch your tongue it's recessed for super filtration no better filter on any leading cigarette discover this fresh new way to smoke may be healed this is mayfield the only menthol cigarette with the recessed filter mayfield fresh new way to smoke this is mayfield fresh new way to smoke the only menthol cigarette with the recessed filter the most effective filtering method known to cigarette makers most builders are at the tip but may feel filter is inside it can't touch your tongue it's recessed this is super filtration no better filter on any leading cigarette menthol or otherwise the truly effective filter you've been wanting just enough menthol and just enough menthol to smooth out the smoke not enough to blur the taste of the good tobacco's the filter can't touch your tongue because it's inside fresh mayfield leaves your mouth feeling fresh moist clean enjoy this fresh new way to smoke,today cigarette cannot answer today smoking needs only saratoga meets the new challenge the first totally new cigarette saratoga gives you the world's first humor flex pack. moisture proof vacuumformed keep cigarettes twice as fresh and flavorful as any other package can saratoga gives you a new team of filters backtoback one filter fortified with charcron scrubs flavor to make it clean the other keeps it mild now you have the filter you hoped for the flavor you smoke for fresh tobacco flavor that just couldn't be brought to you without this humor flex pack new blend  new pack new team of filters backtoback only saratoga meets the challenge of today smoking needs. more than new it's timely too new charcron smooth saratoga cigarette smoothest taste tobacco ever had saratoga's ultramodern filters double screen smoke. one filter fortified with charcron smooth the smoke the second of pure white filter makes it mild together they double screen the smoke to give saratoga the smoothest taste tobacco ever had and saratoga keeps that rich tobacco flavor because the soft seamless pack keeps flavor in this empty pack test proves saratoga holds moisture and flavor as no conventional packed can. the fact that leaks water leaks flavored but saratoga's hummus like plastic pack seals in the fool fresh flavor. try new saratoga it's charcron smooth smoothest taste  tobacco ever had saratoga. it's new it's ultra it's ultra mild its new saratoga in the humor flex plastic pack first ultra mild cigarette saratoga double screams the flavor clean one filter fortified with charcron screens flavor to make it clean the other re screens it to make it mild together they double screen the flavor clean to make saratoga the first ultra mild cigarette and saratoga keeps its rich tobacco flavor because the new seemless plastic pack keeps moisture in try this yourself empty out of conventional pack and a pack of saratoga's pour a little water into each see just as the water runs out moisture and fresh flavor escape from the regular pack but saratoga seamless pack keeps the fresh moist flavor in. try new saratoga it's ultra it's ultra mild it's the first ultra mild cigarette everything's new in saratoga. this is totally new saratoga cigarette in the world's first humma flex pack moistureproof vacuumformed to keep cigarettes twice as fresh and flavorful as any other package can. saratoga gives you a new team of builders backtoback one filter fortified with charcron scrubs flavor clean the other keeps it in mild get the filter you hoped for the flavor you smoke for in totally new saratoga. more than new it's timely too. new characron smooth saratoga cigarette saratoga's ultramodern filters double screen the smoke for the smoothest taste tobacco ever had and saratoga keeps that rich tobacco flavor because the handsome humma flex plastic pack keeps flavor in try new saratoga it charcron smooth smoothest taste tobacco ever had saratoga. new blend new humma flex pack new team of filters backtoback everything's new in saratoga cigarettes. everything's new in saratoga cigarettes new blend new yuma flex pack new team of filters back to back. saratoga the cigarette that meets the challenge of today's smoking needs new blend new humma flex pack new team of filters backtoback saratoga. new charcron smooth saratoga double screams the smoke for the smoothest taste tobacco ever had saratoga. this is mayfield fresh new way to smoke the only menthol cigarette with the recessed filter the most effective filtering method known to cigarette makers most filters are at the tip but mayfield filter is inside it's clean it can't touch your tongue it's recessed this is super filtration there's no better filter on any leading cigarette menthol or otherwise mayfield brings you the truly effective filter you've been wanting just enough menthol and just enough menthol to smooth out the smoke not enough to blur the taste of the good tobacco's the filter can't touch your tongue because it's inside the mayfield filter is recessed fresh. mayfield leaves your mouth feeling fresh moist clean enjoy this fresh new way to smoke mayfield. this is mayfield the only menthol cigarette with a recessed filter mayfield filter is inside can't touch your tongue it's recessed for super filtration no better filter on any leading cigarette discover this fresh new way to smoke mayfield. this is mayfield the only menthol cigarette with the recessed filter mayfield fresh new way to smoke. this is mayfield fresh new way to smoke the only menthol cigarette with the recessed filter the most effective filtering method known to cigarette makers most filters are at the tip but mayfields filter is inside it can't touch your tongue it's recessed this is super filtration theres no better filter on any leading cigarette menthol or otherwise the truly effective filter you've been wanting just enough menthol and just enough menthol to smooth out the smoke not enough to blur the taste of the good tobacco's the filter can't touch your tongue because it's inside fresh mayfield leaves your mouth feeling fresh moist clean enjoy this fresh new way to smoke mayfield. ,0.3000000119209289,16.600000381469727,0.5,12.800000190734863,0.9073856975381008,0.0002710306057947927
20,tobacco_ipu03f00,76.0,Advertising,https://archive.org/download/tobacco_ipu03f00/170500083_512kb.mp4,1968.0,Fair,0.8411906,0.8233386,0.8528504,hi ed hi joe yeah how do you like it hey you really built the kids imagine well actually it's been as much fun for me is for them the right thanks raleigh's is when have you been smoking them just shaved i like the taste yeah a real tobacco taste how about the coupons way to build a treehouse he got that tree out for ronnie coupons moe that's how i got the to come to raleigh filters comes a good taste and remember the famous wally coupon also comes on life pennzoil bel air you get a special kind of lightness and you smoke bell are special because it involves right,hi ed hi joe yeah how do you like it hey you really built the kids a mansion. well actually it's been as much fun for me is for them. cigarette well thanks wow raleigh's is when have you been smoking them. just changed i like the taste. yeah a real tobacco taste how about the coupons way to build a treehouse you got the tree house for raleigh coupons no that's how i got the tools. come to raleigh filters come a good taste and remember the famous raleigh coupon also comes on life pennzoil bel air bel air taste light cause the menthol's right. bel air taste light cuse the menthol's right. just the right touch of menthol. with the right filter too. you get a special kind of lightness when you smoke bel air special because it involves right,0.8999999761581421,0.8999999761581421,0.4000000059604645,6.400000095367432,0.6690140845070423,0.002099071737252447
21,tobacco_ziw99d00,2434.0,Advertising,https://archive.org/download/tobacco_ziw99d00/93130527-0528_512kb.mp4,1987.0,Excellent,0.850175523,0.64843243,0.91283864,this is living some people don't think so you don't do you you get to thinking there must be a better way a better something so you take some independent action you break away from the crowd and you find something better including a better cigarette perhaps old gold filters the cigarette for independent people old gold filters a delicious mixture of rich tobacco flavors flavors that hurricane through a filter before flavors for you not for the crowd but for you old gold filters the cigarette for independent people with flavors that never came through a filter before this is living some people don't think so you don't do you get the thinking there must be a better way a better something sorry to take some independent action you break away from the crowd and you find something better including better cigarette behalf old gold filters the cigarette for independent people all gold filters are delicious mixture of rich tobacco flavors flavors that never came through a filter before flavors for you not for the crowd but for you old gold filters the cigarette for independent people with flavors that never came through a filter before some people follow the crowd some people don't he doesn't he thinks is a better way a better something so he takes them in the planet action he doesn't like the crowd so he finds something better if you are independent you'll find what you want maybe you'll find the better cigarette to old gold filters cigarette for independent people old gold filters the delicious mixture of rich tobacco flavors flavors that never came through a filter before flame is for you not for the crowd but see you old gold filters the cigarette for independent table the flavors of never came through a filter before this is living some people think so some people don't he doesn't he thinks there's a better way better something so he takes some independent action it doesn't like the cry sorry find something better if you're independent you'll find what you want maybe you'll find the better cigarette to all gold filters the cigarette for independently all gold filters a delicious mixture of rich tobacco flynn's waivers of never came through a filter before flavors for you not for the crowd but for you all goldfish filters the cigarette for independently with flavors that never came through a filter before some people follow the crowd some people don't he doesn't he thinks there's a better way a better something so he takes some independent action if you are independent you may do the same thing break away from the crowd find something better but a cigarette perhaps old gold filters a cigarette for independent people all gold filters a delicious mixture of rich tobacco flavors flavors that never came through a filter before flavors for you not for the crowd but for you old gold filters the cigarette for independent people with flavors that never came through a filter before some people follow the crowd some people don't he doesn't he thinks there's a better way a better something so he takes some action if you are independent you may do the same thing break away from the crowd find something better but a cigarette perhaps old gold filters the cigarette for independent people all gold filters a delicious mixture of rich tobacco flavors flavors that never came through a filter before flavors for you now for the crowd but for you all gold filters the cigarette for independent people with flavors that never came through a filter before this is living some people don't think so you don't do you you get to thinking there must be a better way better something so it takes an independent action you break away from the crowd and you find something better including a bettertasting cigarette perhaps old gold filters the cigarette for independent people all gold filters at the his mixture of rich tobacco flavors flavors that never came through a filter before flavors for you not for the crowd but feel old goldfish something extra to gift star coupons and every pack of old gold filters and get gift star coupons on fresh tasting menthols bring 100 this is living some people don't think so you don't do you you get to thinking there must be a better way so you think's an independent action get break away from the crowd and you find something better including a bettertasting cigarette perhaps although filters the cigarette for independent people all gold filters that delicious mixture of rich tobacco flavors flavors and ever came through a filter before flavors for you not for the crowd but for you old gold filters something extra to gifts to our coupons and every pack of old gold filters and get gifts to our coupons and fresh tasting menthol spring 100s this is living some people think there's a better way if you're independent you set your own style you don't follow the crowd you find a better something including a bettertasting cigarette practice old gold filters the cigarette for independent people old gold filters a delicious mixture of rich tobacco flavors flavors that never came through a filter before something extra to gift star coupons the gift coupons she said the flavor i'm after why smoke em if you can't taste them old gold filters the cigarette for independent people with flavors that never came through a filter before and with gift store coupons same coupon that comes on fresh tasting mental spring 100 you call this living some people don't think so if you're independent you'll find a better way and the better tasting cigarette brass old gold filters the cigarette for independent people with flavors that never came through a filter before old gold filters now with gift store coupons this is living some people think there's a better way if you're independent you set your own style you don't follow the crowd you find it that is something including a bettertasting cigarette perhaps old gold filters the cigarette for independent people oh goldfish delicious mixture of rich tobacco flavors flavors that never came through a filter before something extra to gift star coupons give coupons are for her as a flavor i'm after why spoken with you can't taste them old gold filters cigarette for independent people with gift store coupons same coupon that comes jean freshtasting meant for spring 100 ,this is living some people don't think so you don't do you you get to thinking there must be a better way a better something so you take some independent action you break away from the crowd and you find something better including a better cigarette perhaps old gold filters the cigarette for independent people old gold filters a delicious mixture of rich tobacco flavors flavors that never came through a filter before flavors for you not for the crowd but for you old gold filters the cigarette for independent people with flavors that never came through a filter before. this is living some people don't think so you don't do you you get the thinking there must be a better way a better something so you take some independent action you break away from the crowd and you find something better including a better cigarette perhaps old gold filters the cigarette for independent people old gold filters are delicious mixture of rich tobacco flavors flavors that never came through a filter before flavors for you not for the crowd but for you old gold filters the cigarette for independent people with flavors that never came through a filter before. some people follow the crowd some people don't he doesn't he thinks is a better way a better something so he takes some independent action he doesn't like the crowd so he finds something better if you are independent you'll find what you want maybe you'll find the better cigarette too old gold filters the cigarette for independent people old gold filters the delicious mixture of rich tobacco flavors flavors that never came through a filter before flavors for you not for the crowd but for you old gold filters the cigarette for independent people the flavors of never came through a filter before. this is living some people think so some people don't he doesn't he thinks there's a better way better something so he takes some independent action he doesn't like the crowd so he find something better if you're independent you'll find what you want maybe you'll find the better cigarette to old gold filters the cigarette for independent people old gold filters a delicious mixture of rich tobacco flavors flavors that never came through a filter before flavors for you not for the crowd but for you old gold filters the cigarette for independent people with flavors that never came through a filter before. some people follow the crowd some people don't he doesn't he thinks there's a better way a better something so he takes some independent action if you are independent you may do the same thing break away from the crowd find something better but a cigarette perhaps old gold filters a cigarette for independent people old gold filters a delicious mixture of rich tobacco flavors flavors that never came through a filter before flavors for you not for the crowd but for you old gold filters the cigarette for independent people with flavors that never came through a filter before. some people follow the crowd and some people don't he doesn't he thinks there's a better way a better something so he takes some independent action if you are independent you may do the same thing break away from the crowd find something better but a cigarette perhaps old gold filters the cigarette for independent people old gold filters a delicious mixture of rich tobacco flavors flavors that never came through a filter before flavors for you not for the crowd but for you old gold filters the cigarette for independent people with flavors that never came through a filter before. this is living some people don't think so you don't do you you get to thinking there must be a better way better something so it takes an independent action you break away from the crowd and you find something better including a bettertasting cigarette perhaps old gold filters the cigarette for independent people old gold filters a delicous mixture of rich tobacco flavors flavors that never came through a filter before flavors for you not for the crowd but for you old gold filters something extra too gift star coupons on every pack of old gold filters and get gift star coupons on fresh tasting menthols spring 100. this is living some people don't think so you don't do you you get to thinking there must be a better way so you take some independent action get break away from the crowd and you find something better including a bettertasting cigarette perhaps old gold filters the cigarette for independent people old gold filters that delicious mixture of rich tobacco flavors flavors that ever came through a filter before flavors for you not for the crowd but for you old gold filters something extra too gifts star coupons on every pack of old gold filters and get gifts star coupons on fresh tasting menthol spring 100s. this is living some people think there's a better way if you're independent you set your own style you don't follow the crowd you find a better something including a bettertasting cigarette perhaps old gold filters the cigarette for independent people old gold filters a delicious mixture of rich tobacco flavors flavors that never came through a filter before something extra to gift star coupons the gift coupons she save them it's flavor what i'm after why smoke em if you can't taste them old gold filters the cigarette for independent people with flavors that never came through a filter before and with gift star coupons same coupon that comes on fresh tasting mentol spring 100s. you call this living some people don't think so if you're independent you'll find a better way and the better tasting cigarette perhaps old gold filters the cigarette for independent people with flavors that never came through a filter before old gold filters now with gift star coupons. this is living some people think there's a better way if you're independent you set your own style you don't follow the crowd you find it a better something including a bettertasting cigarette perhaps old gold filters the cigarette for independent people old gold filters a delicious mixture of rich tobacco flavors flavors that never came through a filter before something extra too gift star coupons gift coupons they're her it's the flavor i'm after why smoke them if you can't taste them old gold filters cigarette for independent people with gift star coupons same coupon that comes on fresh tasting menthol spring 100s. ,0.0,4.199999809265137,0.0,1.899999976158142,0.9057639524245197,0.00019553801728137735
