,id,runtime,category,url,year,fellow_accuracy_rating,automl_confidence_avg,automl_confidence_min,automl_confidence_max,computer_transcript,human_transcript,sentiment,magnitude,human_sentiment,human_magnitude,war,bleu_score
0,tobacco_rdz99d00,89.0,Advertising,https://archive.org/download/tobacco_rdz99d00/tobacco_rdz99d00.mp4,1966.0,Poor,0.765764925,0.7584321,0.77309775,then is the newport a welcome place never hush never rough taste brescia smooth and refreshing day after day that's the taste of newport is tasty,"﻿smooth and fresh is the newport taste. welcome flavor you won’t forget. newport tastes smoother




never harsh never rough.


newport tastes fresher. 


smooth and refreshing day after day. that's the taste of newport. the smoother taste in menthol cigarette.",0.800000011920929,0.800000011920929,0.800000011920929,5.699999809265137,0.3846153846153846,0.0072658577559704465
1,tobacco_amp91f00,325.0,Advertising,https://archive.org/download/tobacco_amp91f00/VTS_01_1_512kb.mp4,1994.0,,0.844540638,0.75954443,0.91270757,when i think about it most of my friends who smoke have become more and more considerate of people like me who don't so when i read amendment one i wondered whether we were being fair to them raising taxes by 50 cents a pack seems a little high then it puts a sales tax on cigarettes and let cities and counties tax tobacco with no limits isn't that a lot of money from one group to pay for programs that should be everyone's responsibility before you vote reid amendment one that ask yourself is it really fair we the people of color on our state constitution for 157 years it's kept our democratic ideals and principles and protected our individual rights so why would we put tobacco taxes and health care spending programs into it the tobacco amendment is a constitutional amendment it makes health care spending programs and three new tobacco taxes permanent parts of colorado's constitution vote no on the tobacco tax amendment because even if your for the spending programs in new taxes they don't belong in our constitution ballot initiatives can be confusing so before you vote read proposition 200 carefully then ask yourself is a 90 million dollar tax increase on smokers really fair where will the money go and why would we give millions to bureaucrats without any controls on how it's bent prop 200 has a lot of problems but don't take my word for it copies of prop 200 are available in the secretary of state's office so you can read it and make the right choice paid for by the no more taxes committee majority of funding provided by the tobacco industry and the tobacco institute paid for by the no more taxes committee majority of funding provided by the tobacco industry and the tobacco institute kozeny californians they raise millions by taxing smokers but look how they spent the money five hundred thousand dollars to sponsor a race car they wasted even more money sponsoring floats and parades they even paid for a fiveday pool party cool now they want to do the same thing in arizona vote no on prop 200 wasting tax money is one california idea we don't need bummer arizona's cancer heart and lung association's and 200 000 arizona citizens worked hard to place proposition 200 the tobacco tax on the ballot now the tobacco companies are paying us a visit and they're dressing up for the occasion they're coming to protect their profits by trying to defeat the tobacco tax and they're going to mislead the public under the cloak of deception don't let the tobacco companies pull the wool over your eyes paid for by a healthy future healthcare providers and the arizona hospital association it's a shame isn't it most of them started smoking so young and they weren't told that the nicotine in cigarettes could keep them hooked forever but now we know how to keep tobacco out of the hands of kids we can prevent vending machine sales and crack down on merchants who sell to minors we can also raise the cost of cigarettes through change in public policy and increase education about the effects of smoking and when fewer children are smoking will all breathe a little easier on your mom will love those flowers are mom she's doing okay you're sick and tired of the cigarette prism the one of us to sell cigarettes which all the more wages they say they're not advertising cigarettes to children but kids recognize joe camel nearly as much as mickey mouse or even giving us a mother had named i'd like to give those compasso companies a piece of my mind i told him what a battery stones they are on the kids in arizona we will camp was don't smoke and kids shouldn't either,"﻿when i think about it most of my friends who smoke have become more and more considerate of people like me who don't. so when i read amendment one i wondered whether we were being fair to them. raising taxes by 50 cents a pack seems a little high then it puts a sales tax on cigarettes and let cities and counties tax tobacco with no limits.
isn't that a lot of money from one group to pay for programs that should be everyone's responsibility before you vote read amendment one then ask yourself “is it really fair”.


we we the people of colorado. . . our state constitution for 157 years it's kept our democratic ideals and principles and protected our individual rights so why would we put tobacco taxes and health care spending programs into it the tobacco amendment is a constitutional amendment it makes health care spending programs and three new tobacco taxes permanent parts of colorado's constitution. vote no on the tobacco tax amendment because even if you’re for the spending programs in new taxes they don't belong in our constitution.


ballot initiatives can be confusing so before you vote read proposition 200 carefully then ask yourself “is a 90 million dollar tax increase on smokers really fair where will the money go and why would we give millions to bureaucrats without any controls on how it's spent” prop 200 has a lot of problems but don't take my word for it. copies of prop 200 are available in the secretary of state's office so you can read it and make the right choice. paid for by the no more taxes committee majority of funding provided by the tobacco industry and the tobacco institute. paid for by the no more taxes committee majority of funding provided by the tobacco industry and the tobacco institute.


cozeny californians they raise millions by taxing smokers but look how they spent the money. five hundred thousand dollars to sponsor a race car they wasted even more money sponsoring floats and parades they even paid for a fiveday pool party cool. now they want to do the same thing in arizona vote no on prop 200. wasting tax money is one california idea we don't need. bummer.


 arizona's cancer heart and lung association's and 200 000 arizona citizens worked hard to place proposition 200 the tobacco tax on the ballot now the tobacco companies are paying us a visit and they're dressing up for the occasion. they're coming to protect their profits by trying to defeat the tobacco tax and they're going to mislead the public under the cloak of deception. don't let the tobacco companies pull the wool over your eyes. paid for by arizona for a healthy future healthcare providers and the arizona hospital association.


it's a shame isn't it. most of them started smoking so young and they weren't told that the nicotine in cigarettes could keep them hooked forever. but now we know how to keep tobacco out of the hands of kids. we can prevent vending machine sales and crack down on merchants who sell to minors we can also raise the cost of cigarettes through change in public policy and increase education about the effects of smoking and when fewer children are smoking we’ll all breathe a little easier. oh your mom will love those flowers. how is my mom she's doing okay.


you're sick and tired of the cigarette prison. who’s to tell us us to sell cigarettes it’s outrageous.  they say they are not advertising cigarettes to children but kids recognize joe camel nearly as much as mickey mouse they could’ve given us a better name. i'd like to give those tobacco companies a piece of my mind. i’d tell him what a battery they are on the kids in arizona. no camels don’t smoke and kids shouldn’t either.",-0.800000011920929,2.400000095367432,-0.3000000119209289,17.399999618530273,0.882170542635659,0.0004494968102981707
2,tobacco_xpu03f00,688.0,Advertising,https://archive.org/download/tobacco_xpu03f00/170500098_512kb.mp4,1961.0,Good,0.813683908,0.5487559,0.9106133,hardly folks if you have never smoked raleigh cigarettes what would you be missing but we do smoke wrong sure you do that's why you didn't miss out on the hose and real the table and radio even that handy sewell all three pray for raleigh coupon the voice of all we miss had wonderful ronnie pace they're rich mild and nala i like to throw leaffilter to we violently by the party that way our coupons not a fast is he you get a coupon on every pack and pour extra and every pocket 14 and i don't see why everybody doesn't smoke rise yes raleigh the only cigarette that gives you finest quality tobacco plus on the back of every pack of valuable coupons filed by the cartons and get 4 extra group on those are deaf or plain ends look molly hardly poke is you had never smoked raleigh cigarettes what would you be missing but we do smoke raleigh sure you do that's why you didn't miss out on the transistor radio the camera even that handsome set of matched luggage all free free for rally coupon but most of all we did that wonderful raleigh take their rich mild and mellow i like this vale filtered to we buy raleigh's by the carton that way our coupons manifest to see you get a coupon on every pet and for extra in every carton 14 and all i don't see why everybody doesn't smoke rowley yes raleigh they only cigarette that gives you finest quality tobacco plus on the back of every pack of valuable coupons final by the carton and get 4 extra groupon filtered air for plane in smoke trolley pardon me folks if you have never smoked raleigh cigarettes do you know what you'd be missing the dinner where the percolator even the silver but we do smoke raleigh sure you do that's why you didn't miss out on all those wonderful gifts free free for raleigh coupons but most of all we did that one for raleigh taste rich mild and mellow i like the trolley delta to we buy rallies by the cotton that we are coupons not a fast you see you get a coupon on every pack or extra in every carton 14 and all i don't see why everybody doesn't smoke product yes raleigh the only cigarette that gives you finest quality tobacco plus on the back of every fact of valuable coupons by and by the carton and get thor extra coupons those are deaf are plain ends smoke raleigh pardon me folks if you had never smoked raleigh cigarettes do you know what you'd be missing that electric grill all those hand tools even the portable radio but we do smoke raleigh sure you do that's why you didn't miss out on all those wonderful gifts free 34 raleigh coupons best of all we did that wonderful valley taste their rich mild and mellow i like those raulito her to we buy raleigh bought a carton that way our coupons manifest he feet you get a coupon on every pack and or extra every cocky 40 in all i don't see why everybody does he smoke raleigh yes raleigh they only cigarettes that gives you finest qualities of a co + on the back of every fact of valuable coupons by on by the cartridge and get 4 extra coupons those are deaf or plain end smoke raleigh what's so interesting is nur ali premium catalog look at all the brand new gifts we can give our wally coupon yeah we had that table and land i'll take that path pardon me folks but how do you like that new raleigh premium catalog great and exciting new gift y fo and how about that raleigh taste that's the best part they're rich mild and mellow i like this raw leaffilter to if i rallied by the cotton that we are coupons mount up fast you see you get a coupon on every tak and for extra and every carton 14 at all i don't see why everybody doesn't smoke rise smoke raleigh's doesn't it for plane in and get your free copy of the new raleigh premium catalog bigger and better than ever right raleigh but 903 louisville kentucky hardly fault if you ever smoked raleigh cigarettes do you know what you've been missing that one allele a picnic test even that spoiler role but we do smoke raleigh's sure you do that's why you didn't miss out on all those wonderful gifts free free for raleigh two of us but most of all we had that wonderful raleigh tape they're rich mild and mellow oh at this rally filter to we buy raleigh's by the carton that way our coupons mount up fast you see you get a coupon on every path and for extra and every carton 14 and all i don't see why everybody doesn't smoke rolly rolly the only cigarettes at issue finest quality for battle plus valuable coupons fire by the party and get 4 extra coupons raleigh comes both ways with a builder or without smoke rollies hardly both if you had never smoked raleigh cigarettes do you know what you'd be missing that screen projector even though holding shares but we do saw trolley sure you do that's why you didn't miss out on all those wonderful gifts free free for raleigh coupons but most of all we use that wonderful raleigh taste their rich mild mellow i like this raw leaffilter to me by bali's by the cocky that way our coupons not a fast you see you get a coupon on every pack and for xray every carton 14 in all i don't see why everybody doesn't smoke rolly rolly the only figure out that issue finest quality to battle plus valuable coupons fire by the cartons and get 4 extra coupons lolly comes always with a filter or without about smoke rollies if you would never smoke rolling cigarettes do you know what you'd be missing the swingarm and so forth even the blanket we do spoke wrongly sure you do that's why you didn't miss out on all those wonderful gifts free free for wide coupons but most of all we did this that wonderful raleigh taste are reach mild and metal i like the size filter to he buys by the cotton that way our coupons love that you see you get a coupon on every pack and for extra and every carton 14 and all i don't see why everybody doesn't smoke rise raleigh they only cigarettes at issue finest quality to battle plus valuable coupons fire by the carton i get 4 extra coupons lat both ways with a filter or without smoke raleigh hardly folks if you have never smoked raleigh cigarettes do you know what you'd be missing that screen projector even though folding chairs but we do smoke raleigh sure you do that's why you didn't miss out on all those wonderful gifts free free for raleigh coupons but most of all we missed that wonderful rally taste their rich mild and mellow i like this raw leaffilter to we buy bali's by the cocky that way our coupons not a fast you see he get a coupon on every path and for extra and every carton 14 and all i don't see why everybody doesn't smoke rolly rolly the only figure out that issue finest quality for battle plus valuable coupons fire by the cartons and get 4 extra coupons rowley from both ways with a filter or without smoke raleigh today 8 out of 10 families save coupons and sense 8 out of 10 we saved coupons and stand it's a smart way to shop and wally coupons are worth a lot more yes and you get 14 in every garden and how about those raleigh premiums are the greatest that's how we got ice cream projector and folding chairs all free free for raleigh coupons and there's something else you get with rowley take they're rich mild and now the best cigarette the most valuable coupons and the finest premiums that's what raleigh gives you i don't see why everybody doesn't smoke rolly rolly the only cigarette that gives you finest product paperback all plus valuable coupons i am by the carton i get 4 extra coupons 14 at all ronnie comes both ways with a filters or without smoke raleigh's,"﻿pardon me folks if you have never smoked raleigh cigarettes what would you be missing
 but we do smoke raleigh. sure you do that's why you didn't miss out on the hose and reel the table and radio even that handy stool. all three free for raleigh coupon.
but most of all we’d miss that wonderful raleigh taste.  they're rich mild and mellow. i like the raleigh filter too. we buy raleigh by the carton that way our coupons mont as fast.
you see you get a coupon on every pack and four extra in every carton 14 in all. i don't see why everybody doesn't smoke raleigh. yes raleigh the only cigarette that gives you finest quality tobacco plus on the back of every pack are valuable coupons. buy them by the cartons and get 4 extra coupons filter tip or plain ends. smoke raleigh. 


pardon me folks if you have never smoked raleigh cigarettes what would you be missing
 but we do smoke raleigh. sure you do that's why you didn't miss out on the transistor radio the camera even that handsome set of matched luggage all free. free for raleigh coupons. but most of all we’d miss that wonderful raleigh taste.  they're rich mild and mellow. i like this raleigh filter too. we buy raleigh's by the carton that way our coupons mount up fast. you see you get a coupon on every pack and four extra in every carton 14 in all. i don't see why everybody doesn't smoke raleigh. yes raleigh the only cigarette that gives you finest quality tobacco plus on the back of every pack are valuable coupons. buy them by the cartons and get 4 extra coupons filter tip or plain ends. smoke raleigh. 


pardon me folks if you have never smoked raleigh cigarettes do you know what you'd be missing the dinnerware the percolator even the silver. but we do smoke raleigh. sure you do that's why you didn't miss out on all those wonderful gifts free free for raleigh’s coupons. but most of all we get that wonderful raleigh taste rich mild and mellow. i like the raleigh filter too. we buy raleighs by the carton that way our coupons mount up fast. you see you get a coupon on every pack fourr extra in every carton 14 in all. i don't see why everybody doesn't smoke raleigh. yes raleigh the only cigarette that gives you finest quality tobacco. plus on the back of every pack a valuable coupon. buy them by the carton and get four extra coupons. filter tip or plain ends smoke raleigh


pardon me folks if you had never smoked raleigh cigarettes do you know what you'd be missing that electric grill all those hand tools even the portable radio but we do smoke raleigh. sure you do that's why you didn't miss out on all those wonderful gifts free. free for raleigh coupons. most of all we’d miss that wonderful  raleigh taste they’re rich mild and mellow. i like those  raleigh filters too. we buy raleigh by the carton that way our coupons mount up fast. you see you get a coupon on every pack and or extra every carton 14 in all i don't see why everybody does he smoke raleigh. yes raleigh the only cigarettes that gives you finest quality tobacco plus on the back of every pack a valuable coupon. buy them by the carton and get 4 extra coupons. filter tip or plain end smoke raleigh.


what's so interesting this new  raleigh premium catalog. look at all the brand new gifts we can get with our raleigh coupon. gee i wish we had that table and lamp.  i'll take that hat.


pardon me folks but how do you like that new raleigh premium catalog great and exciting new gifts wonderful and how about that raleigh taste that's the best part they're rich mild and mellow. i like this  raleigh filter.  we buy  raleigh by the cotton that we are coupons mount up fast. you see you get a coupon on every pack and four extra in every carton 14 in all. i don't see why everybody doesn't smoke raleigh. smoke raleigh's filter tip or plain end and get your free copy of the new raleigh premium catalog bigger and better than ever. write raleigh box 903 louisville kentucky.


pardon me folks if you had never smoked raleigh cigarettes do you know what you'd be missing that rod and reel the picnic chest even that sporter rug. but we do smoke raleigh's. sure you do that's why you didn't miss out on all those wonderful gifts free free for raleigh coupons. but most of all we get that wonderful raleigh taste they're rich mild and mellow. i like this raleigh filter too. we buy raleigh's by the carton that way our coupons mount up fast . you see you get a coupon on every pack and four extra in every carton 14 in all. i don't see why everybody doesn't smoke raleigh. the only cigarettes that gives you finest quality tobacco. plus valuable coupons. buy them by the carton and get 4 extra coupons. raleigh comes both ways with a filter or without. smoke raleigh's.


pardon me folks if you had never smoked raleigh cigarettes do you know what you'd be missing that screen the projector even the folding chairs. but we do smoke raleigh. sure you do that's why you didn't miss out on all those wonderful gifts free free for raleigh coupons. but most of all we’d miss that wonderful raleigh taste they’re rich mild and mellow. i like this raleigh  filter too. we buy raleigh's by the carton that way our coupons mount up fast. you see you get a coupon on every pack and four extra in every carton 14 in all. i don't see why everybody doesn't smoke raleigh. raleigh the only cigarettes that gives you finest quality tobacco. plus valuable coupons. buy them by the carton and get 4 extra coupons. raleigh comes both ways with a filter or without. smoke raleigh's.


(0748)  pardon me folks if you had never smoked raleigh cigarettes do you know what you'd be missing the swingarm lamp that chalkboard even the blanket. but we do smoke raleigh. sure you do that's why you didn't miss out on all those wonderful gifts free free for raleigh coupons. but most of all we’d miss that wonderful raleigh taste they’re rich mild and mellow. i like this raleigh  filter too. we buy raleigh's by the carton that way our coupons mount up fast. you see you get a coupon on every pack and four extra in every carton 14 in all. i don't see why everybody doesn't smoke raleigh. raleigh the only cigarettes that gives you finest quality tobacco. plus valuable coupons. buy them by the carton and get 4 extra coupons. raleigh comes both ways with a filter or without. smoke raleigh's.


pardon me folks if you had never smoked raleigh cigarettes do you know what you'd be missing that screen the projector even the folding chairs. but we do smoke raleigh. sure you do that's why you didn't miss out on all those wonderful gifts free free for raleigh coupons. but most of all we’d miss that wonderful raleigh taste they’re rich mild and mellow. i like this raleigh  filter too. we buy raleigh's by the carton that way our coupons mount up fast. you see you get a coupon on every pack and four extra in every carton 14 in all. i don't see why everybody doesn't smoke raleigh. raleigh the only cigarettes that gives you finest quality tobacco. plus valuable coupons. buy them by the carton and get 4 extra coupons. raleigh comes both ways with a filter or without. smoke raleigh's.
 
today 8 out of 10 families save coupons and stamps 8 out of 10. we saved coupons and stamps it's a smart way to shop. and raleigh coupons are worth a lot more. yes and you get 14 in every carton. and how about those raleigh premiums they’re the greatest that's how we got screen projector and folding chairs all free free for raleigh coupons. and there's something else you get with raleighs taste they're rich mild and mellow. the best cigarette the most valuable coupons and the finest premiums that's what raleigh gives you. i don't see why everybody doesn't smoke raleigh. raleigh the only cigarette that gives you finest quality tobacco plus valuable coupons. buy them by the carton and get 4 extra coupons 14 at all. raleigh comes both ways with a filter or without. smoke raleigh's",0.3000000119209289,2.700000047683716,0.3000000119209289,70.0,0.7113115891741846,0.00020319694419902853
5,tobacco_lez99d00,96.0,Advertising,https://archive.org/download/tobacco_lez99d00/tobacco_lez99d00.mp4,1968.0,Excellent,0.86617267,0.8458153,0.88653004,he's an independent guy he likes to set his own kind of style doesn't care what's in or new chooses things to suit his taste couldn't care what others do he's a no gold filters man just with an independent gold filters the cigarette for independent people now in 100 size to the better 100 with flavors that never came through a filter before and with valuable gift store coupons the gift coupons she's asian it's the flavor am after why smoke em if you can taste it he's an old gold filters man now old gold filters in 100 size the better 100 with gift star coupons,"﻿he's an independent guy he likes to set his own kind of style doesn't care what's in or new chooses things to suit his taste couldn't care what others do he's a old gold filters man.


just an ordinary guy with an independent mind a mind that is all he needs. he’s an old gold filters man.  old gold filters the cigarette for independent people now in 100 size too the better 100 with flavors that never came through a filter before and with valuable gift star coupons. the gift coupons she saves them it's the flavor i’m after why smoke them if you can taste it he's an old gold filters man. now old gold filters in 100 size the better 100 with gift star coupons.",-0.4000000059604645,0.4000000059604645,0.2000000029802322,2.299999952316284,0.7559055118110236,0.0019857831650453754
